id,name,text,trans
0000000000000,星南,……あら、プロデューサー。,……哎呀，制作人。
0000000000000,星南,ようこそ、生徒会室へ。,欢迎来到学生会室。
0000000000000,星南,今日は休日のはずだけど……\nなにか私に用かしら？,今天应该是休息日才对……\n是找我有事吗？
0000000000000,{user},星南さんが、浮かない顔を\nしているのを見かけたもので。,因为看到星南同学\n似乎闷闷不乐的样子。
0000000000000,{user},夢を叶えた翌日なのに、\nどうしたのかと気になりまして。,明明刚实现梦想的第二天，\n有点在意是怎么回事。
0000000000000,星南,……フフ、本当に、よく見ているわね。\n気付いたのは、あなたが最初よ。,……呵呵，真是观察入微呢。\n第一个注意到的人就是你。
0000000000000,星南,……実は、ライブの最後にした、\nあの発言……,……其实是因为，演唱会最后\n我说的那段话……
0000000000000,星南,この私を――\n『一番星』を目指しなさい！！！,要以这个我——\n以『一等星』为目标！！！
0000000000000,星南,アイドルの頂点は――\nあなたたちの夢は、ここにある！,偶像的巅峰就在——\n你们的梦想，就在这里！
0000000000000,星南,私のファンたちが……\nとても喜んでくれているようなの。,我的粉丝们……\n好像都特别高兴的样子。
0000000000000,{user},……あれはもう、熱狂していると\n言ってもいいくらいでしょうね。,……那个场面，说是狂热\n也不为过吧。
0000000000000,{user},昨日のライブには、\nあなたが心から発した言葉には、,昨天的演唱会，\n你那发自内心的话语，
0000000000000,{user},それだけの力があった。,确实具有这样的力量。
0000000000000,星南,ええ……ふふっ……嬉しいわ。,嗯……呵呵……真开心。
0000000000000,星南,ただ……羽目を外し\nすぎている人もいるようで、,只是……似乎也有些\n兴奋过头的人，
0000000000000,星南,昨日集まってくださった、伝説の\nアイドルの皆様。そのファンたちと……,昨天到场的传奇偶像们。\n她们的粉丝正在……
0000000000000,星南,ネットで大喧嘩しているのよ～～～！,在网上吵得不可开交呢～～～！
0000000000000,星南,『どうだぁ見たか貴様らぁ！』,『怎么样啊看到了吧你们这群家伙！』
0000000000000,星南,『十王星南こそが真のトップアイドル\nだと思い知ったか～！』って！,『现在知道十王星南才是真正的\n顶级偶像了吧～！』
0000000000000,{user},……そのようですね。把握しています。,……看来是这样呢。我已经掌握了情况。
0000000000000,星南,プロデューサー、私、ど、ど、\nどうしたらいいかしら……！,制作人，我、我、\n我该怎么办才好啊……！
0000000000000,星南,私の大切なファンたちが、\n目上の方々に大変な失礼を……！,我最珍视的粉丝们，\n对长辈们做出了非常失礼的事……！
0000000000000,{user},このくらいなら放置しても、\n大事にはならないと思いますよ。,我觉得这种程度放着不管，\n也不会演变成什么大问题哦。
0000000000000,{user},安心してください。大事になっても、\nそのときはなんとかしますから。,请放心。就算真的演变成大问题，\n到时候我也会想办法解决的。
0000000000000,星南,――――頼りになるわねあなた……！,————你真可靠呢……！
0000000000000,星南,私、プロデューサーになったとき、\nあなたみたいにやれる気がしないわ。,我成为制作人的时候，\n肯定做不到像你这样。
0000000000000,{user},プロデューサーとしては、\n先輩ですから。,毕竟作为制作人来说，\n我可是前辈呢。
0000000000000,{user},まだまだ後輩には負けられません。,可不能输给学弟学妹们。
0000000000000,星南,いつか……追いついてみせるわ。,总有一天……我会追上你的。
0000000000000,{user},聞くまでもないことですが、\nプロデューサーになるという目標は――,虽然不用问也知道，\n但成为制作人这个目标——
0000000000000,星南,もちろん、いまも変わらないわ。\nだいぶ……先の話にはなったけれど。,当然，至今也没有改变哦。\n虽然……实现的日子还很遥远。
0000000000000,{user},春とは大きく状況が\n変わったと思いますが。,和春天相比，\n情况已经大不相同了吧。
0000000000000,星南,それでもよ。,即便如此也好。
0000000000000,星南,私は夢を叶えて、\nトップアイドルになった。,我已经实现了梦想，\n成为了顶级偶像。
0000000000000,星南,アイドルが憧れるに\n相応しい<r\=アイドル>偶像</r>になれたわ。,成为了值得被其他偶像憧憬的<r\=アイドル>偶像</r>呢。
0000000000000,星南,けれど……この輝きは、\nあくまでファンからもらったもの。,但是……这份光芒，\n终究是从粉丝那里获得的。
0000000000000,星南,私の……素の<r\=ステータス>能力値</r>は、依然として、,我真实的……<r\=ステータス>能力值</r>，依然
0000000000000,星南,トップアイドルの基準を\n満たすものではないわ。,没有达到顶级偶像的标准呢。
0000000000000,星南,なのに知名度はさらに上がって、\n有名になって、これからは――,可知名度却越来越高，\n变得越来越有名，今后——
0000000000000,星南,最上位のアイドルたちと\n比較される日々が続く。,每天都要被拿来和\n最顶级的偶像们比较了。
0000000000000,星南,ファン同士の対立、アンチの増加。\n巨大な期待が圧し掛かってきて――,粉丝之间的对立，黑粉的增加。\n巨大的期待压得人喘不过气——
0000000000000,星南,夢を叶えたというのに、私の悩みは\n減るどころか深まるばかりよ。,明明已经实现了梦想，我的烦恼\n不但没有减少反而愈发深重。
0000000000000,星南,だからこそ、ね。こう思うの。\nこんな経験をしてきた……,正因如此呢。我才这么想。\n经历过这些之后……
0000000000000,星南,元トップアイドルの\nプロデューサーがいたら、,如果有位曾经培育过\n顶级偶像的制作人在场，
0000000000000,星南,あなたに負けないプロデューサーに\nなれるんじゃないか、って。,说不定我也能成为不输给你的\n制作人呢。
0000000000000,{user},――――――――――――,————————————
0000000000000,星南,珍しいわね。\nあなたが動揺するなんて。,真稀奇呢。\n你居然会动摇。
0000000000000,{user},……いまのは、どういう意味ですか？,……刚才那句话，是什么意思？
0000000000000,星南,フフ……わかってるくせに。\n私の口から言わせたいの？,呵呵……明明心知肚明。\n非要让我亲口说出来吗？
0000000000000,星南,仕方ないわね……一度だけよ？,真拿你没办法……就这一次哦？
0000000000000,星南,一番星のトップアイドル、\n十王星南を育てたあなたは――,培养出一等星顶级偶像\n十王星南的你啊——
0000000000000,星南,プロデューサーとしての……\n私の憧れで、夢で、目標なの。,作为制作人来说……\n正是我憧憬的、梦想的、追逐的目标。
0000000000000,星南,あなたのそばで、\nあなたに育てられながら……,我要待在你身边，\n接受你的培养……
0000000000000,星南,あなたのすべてを学んでいくわ。,将你的一切都学到手。
0000000000000,星南,だから、これからもよろしくね――,所以，今后也请多指教啦——
0000000000000,星南,私の、トッププロデューサーさん。,我的，顶级制作人先生。
info,adv_dear_jsna_010.txt,,
译者,,,
